### ISSUE TITLE
Any way to use HTTPS proxy? (Nord)

### ISSUE THREAD

**Issue by BlohoJo** [yt-dlp/yt-dlp#1890]
### Checklist

- [X] I'm reporting a bug unrelated to a specific site
- [X] I've verified that I'm running yt-dlp version **2021.12.01**. ([update instructions](https://github.com/yt-dlp/yt-dlp#update))
- [X] I've checked that all provided URLs are alive and playable in a browser
- [X] I've checked that all URLs and arguments with special characters are [properly quoted or escaped](https://github.com/ytdl-org/youtube-dl#video-url-contains-an-ampersand-and-im-getting-some-strange-output-1-2839-or-v-is-not-recognized-as-an-internal-or-external-command)
- [X] I've searched the [bugtracker](https://github.com/yt-dlp/yt-dlp/issues?q=) for similar issues including closed ones. DO NOT post duplicates
- [X] I've read the [guidelines for opening an issue](https://github.com/yt-dlp/yt-dlp/blob/master/CONTRIBUTING.md#opening-an-issue)

### Description

(You need a NordVPN account to test this with Nord, obviously.)

Here's a video that I know is geo-locked to Great Britain (GB):

[https://www.youtube.com/watch?v=Fh7UgrHMjbQ](https://www.youtube.com/watch?v=Fh7UgrHMjbQ)

I can get around this fine in Firefox, using FoxyProxy and entering a UK Nord VPN proxy (HTTPS/SSL on port 89):

[https://nordvpn.com/servers/tools/](https://nordvpn.com/servers/tools/)

Nord VPN proxies are working on HTTPS on port 89. So I am using the yt-dlp command line flag like this:

`--proxy "https://xxxxxxxxx%40xxxxxxx.com:xxxxxxxxxxxxxxxx@uk2344.nordvpn.com:89"`

It doesn't work.

Socks5 proxies seem to be working OK with yt-dlp. Nord no longer allows Socks5 (idiots) and I didn't have any paid accounts with socks5 proxies in the UK to test with, but I was able to find a free one that worked (with errors, but it worked).

I actually seem to remember this has been a long standing issue with youtube-dl... http and https proxies don't work, but socks5 does.

### Verbose log

```shell
E:\USER\temp_ytdl>yt-dlp.exe -Uv --proxy "https://xxxxxxxxx%40xxxxxxx.com:xxxxxxxxxxxxxxxx@uk2344.nordvpn.com:89" --all-subs --sub-format srt -f "bestvideo[ext=mp4]+bestaudio[ext=m4a]/best[ext=mp4]/best" "https://www.youtube.com/watch?v=Fh7UgrHMjbQ"
[debug] Command-line config: ['-Uv', '--proxy', 'https://xxxxxxxxx%40xxxxxxx.com:xxxxxxxxxxxxxxxx@uk2344.nordvpn.com:89', '--all-subs', '--sub-format', 'srt', '-f', 'bestvideo[ext=mp4]+bestaudio[ext=m4a]/best[ext=mp4]/best', 'https://www.youtube.com/watch?v=Fh7UgrHMjbQ']
[debug] Encodings: locale cp1252, fs utf-8, out utf-8 (No ANSI), err utf-8 (No ANSI), pref cp1252
[debug] yt-dlp version 2021.12.01 [91f071a] (win_exe)
[debug] Python version 3.8.10 (CPython 64bit) - Windows-2008ServerR2-6.1.7601-SP1
[debug] exe versions: ffmpeg N-93824-g479a5f644f (fdk), ffprobe N-89595-g40d4b13228, rtmpdump 2.4-20151223-gfa8646d-OpenSSL_1.0.2n-x86_64-static
[debug] Optional libraries: Cryptodome, mutagen, sqlite, websockets
[debug] Proxy map: {'http': 'https://xxxxxxxxx%40xxxxxxx.com:xxxxxxxxxxxxxxxx@uk2344.nordvpn.com:89', 'https': 'https://xxxxxxxxx%40xxxxxxx.com:xxxxxxxxxxxxxxxx@uk2344.nordvpn.com:89'}
ERROR: Unable to obtain version info; Please try again later or Visit  https://github.com/yt-dlp/yt-dlp/releases/latest
[debug] [youtube] Extracting URL: https://www.youtube.com/watch?v=Fh7UgrHMjbQ
[youtube] Fh7UgrHMjbQ: Downloading webpage
WARNING: [youtube] Unable to download webpage: <urlopen error Remote end closed connection without response>
[youtube] Fh7UgrHMjbQ: Downloading android player API JSON
WARNING: [youtube] <urlopen error Remote end closed connection without response>
. Retrying ...
[youtube] Fh7UgrHMjbQ: Downloading android player API JSON (retry #1)
WARNING: [youtube] <urlopen error Remote end closed connection without response>
. Retrying ...
[youtube] Fh7UgrHMjbQ: Downloading android player API JSON (retry #2)
WARNING: [youtube] <urlopen error Remote end closed connection without response>
. Retrying ...
[youtube] Fh7UgrHMjbQ: Downloading android player API JSON (retry #3)
[youtube] Fh7UgrHMjbQ: Downloading iframe API JS
WARNING: [youtube] Unable to download webpage: <urlopen error Remote end closed
connection without response>
[youtube] Fh7UgrHMjbQ: Downloading web player API JSON
WARNING: [youtube] <urlopen error Remote end closed connection without response>
. Retrying ...
[youtube] Fh7UgrHMjbQ: Downloading web player API JSON (retry #1)
WARNING: [youtube] <urlopen error Remote end closed connection without response>
. Retrying ...
[youtube] Fh7UgrHMjbQ: Downloading web player API JSON (retry #2)
WARNING: [youtube] <urlopen error Remote end closed connection without response>
. Retrying ...
[youtube] Fh7UgrHMjbQ: Downloading web player API JSON (retry #3)
WARNING: [youtube] Unable to download API page: <urlopen error Remote end closed connection without response> (caused by URLError(RemoteDisconnected('Remote end closed connection without response')))
ERROR: [youtube] Fh7UgrHMjbQ: Unable to download API page: <urlopen error Remote end closed connection without response> (caused by URLError(RemoteDisconnected('Remote end closed connection without response'))) (caused by URLError(RemoteDisconnected('Remote end closed connection without response')))
  File "yt_dlp\extractor\common.py", line 715, in _request_webpage
  File "yt_dlp\YoutubeDL.py", line 3385, in urlopen
  File "urllib\request.py", line 525, in open
  File "urllib\request.py", line 542, in _open
  File "urllib\request.py", line 502, in _call_chain
  File "yt_dlp\utils.py", line 2929, in https_open
  File "urllib\request.py", line 1357, in do_open
```

**Comment by pukkandan** [comment]
I don't have a Nord VPN account, but I have used yt-dlp with other http proxies, and they have worked fine

> I actually seem to remember this has been a long standing issue with youtube-dl...

Do you have any reference

**Comment by imba-tjd** [comment]
try `HTTPS_PROXY` environment variable

**Comment by nyuszika7h** [comment]
Can confirm, HTTP proxies work but HTTPS are broken, whether via `--proxy` or environment variable.

```
❯ yt-dlp -v --ignore-config --proxy 'http://nyuszika7h:[REDACTED]@swe.torguard.com:6060' --skip-download 'https://www.youtube.com/watch?v=1nvnQcr3CqY'
[debug] Command-line config: ['-v', '--ignore-config', '--proxy', 'http://nyuszika7h:[REDACTED]@swe.torguard.com:6060', '--skip-download', 'https://www.youtube.com/watch?v=1nvnQcr3CqY']
[debug] Encodings: locale UTF-8, fs utf-8, out utf-8, pref UTF-8
[debug] yt-dlp version 2021.09.25
[debug] Python version 3.10.0 (CPython 64bit) - Linux-5.10.0-8-amd64-x86_64-with-glibc2.31
[debug] exe versions: ffmpeg 4.4-static, ffprobe 4.4-static, phantomjs .
[debug] Optional libraries: Crypto, mutagen, sqlite, websockets
[debug] Proxy map: {'http': 'http://nyuszika7h:[REDACTED]@swe.torguard.com:6060', 'https': 'http://nyuszika7h:[REDACTED]@swe.torguard.com:6060'}
[debug] [youtube] Extracting URL: https://www.youtube.com/watch?v=1nvnQcr3CqY
[youtube] 1nvnQcr3CqY: Downloading webpage
[youtube] 1nvnQcr3CqY: Downloading android player API JSON
[debug] Sort order given by extractor: quality, res, fps, source, codec:vp9.2, lang
[debug] Formats sorted by: hasvid, ie_pref, quality, res, fps, source, vcodec:vp9.2(10), acodec, lang, filesize, fs_approx, tbr, vbr, abr, asr, proto, vext, aext, hasaud, id
[debug] Testing thumbnail 41
[debug] Default format spec: bestvideo*+bestaudio/best
[info] 1nvnQcr3CqY: Downloading 1 format(s): 248+251
```
```
❯ yt-dlp -v --ignore-config --proxy 'https://nyuszika7h:[REDACTED]@swe.secureconnect.me:7070' --skip-download 'https://www.youtube.com/watch?v=1nvnQcr3CqY'
[debug] Command-line config: ['-v', '--ignore-config', '--proxy', 'https://nyuszika7h:[REDACTED]@swe.secureconnect.me:7070', '--skip-download', 'https://www.youtube.com/watch?v=1nvnQcr3CqY']                                                                                                                                            [debug] Encodings: locale UTF-8, fs utf-8, out utf-8, pref UTF-8
[debug] yt-dlp version 2021.09.25                                                                                                                                           [debug] Python version 3.10.0 (CPython 64bit) - Linux-5.10.0-8-amd64-x86_64-with-glibc2.31
[debug] exe versions: ffmpeg 4.4-static, ffprobe 4.4-static, phantomjs .                                                                                                    [debug] Optional libraries: Crypto, mutagen, sqlite, websockets
[debug] Proxy map: {'http': 'https://nyuszika7h:[REDACTED]@swe.secureconnect.me:7070', 'https': 'https://nyuszika7h:[REDACTED]@swe.secureconnect.me:7070'}
[debug] [youtube] Extracting URL: https://www.youtube.com/watch?v=1nvnQcr3CqY
[youtube] 1nvnQcr3CqY: Downloading webpage                                                                                                                                  WARNING: [youtube] Unable to download webpage: <urlopen error [Errno 104] Connection reset by peer>
[youtube] 1nvnQcr3CqY: Downloading android player API JSON
WARNING: [youtube] <urlopen error [Errno 104] Connection reset by peer>. Retrying ...
[youtube] 1nvnQcr3CqY: Downloading android player API JSON (retry #1)
WARNING: [youtube] <urlopen error [Errno 104] Connection reset by peer>. Retrying ...
[youtube] 1nvnQcr3CqY: Downloading android player API JSON (retry #2)
WARNING: [youtube] <urlopen error [Errno 104] Connection reset by peer>. Retrying ...
[youtube] 1nvnQcr3CqY: Downloading android player API JSON (retry #3)
[youtube] 1nvnQcr3CqY: Downloading iframe API JS
WARNING: [youtube] Unable to download webpage: <urlopen error [Errno 104] Connection reset by peer>
[youtube] 1nvnQcr3CqY: Downloading web player API JSON
WARNING: [youtube] <urlopen error [Errno 104] Connection reset by peer>. Retrying ...
[youtube] 1nvnQcr3CqY: Downloading web player API JSON (retry #1)
WARNING: [youtube] <urlopen error [Errno 104] Connection reset by peer>. Retrying ...
[youtube] 1nvnQcr3CqY: Downloading web player API JSON (retry #2)
WARNING: [youtube] <urlopen error [Errno 104] Connection reset by peer>. Retrying ...
[youtube] 1nvnQcr3CqY: Downloading web player API JSON (retry #3)
WARNING: [youtube] Unable to download API page: <urlopen error [Errno 104] Connection reset by peer> (caused by URLError(ConnectionResetError(104, 'Connection reset by peer')))
ERROR: [youtube] 1nvnQcr3CqY: Unable to download API page: <urlopen error [Errno 104] Connection reset by peer> (caused by URLError(ConnectionResetError(104, 'Connection reset by peer')))
  File "/home/nyuszika7h/.local/pipx/venvs/yt-dlp/lib/python3.10/site-packages/yt_dlp/extractor/common.py", line 694, in _request_webpage
    return self._downloader.urlopen(url_or_request)
  File "/home/nyuszika7h/.local/pipx/venvs/yt-dlp/lib/python3.10/site-packages/yt_dlp/YoutubeDL.py", line 3256, in urlopen
    return self._opener.open(req, timeout=self._socket_timeout)
  File "/home/nyuszika7h/.pyenv/versions/3.10.0/lib/python3.10/urllib/request.py", line 519, in open
    response = self._open(req, data)
  File "/home/nyuszika7h/.pyenv/versions/3.10.0/lib/python3.10/urllib/request.py", line 536, in _open
    result = self._call_chain(self.handle_open, protocol, protocol +
  File "/home/nyuszika7h/.pyenv/versions/3.10.0/lib/python3.10/urllib/request.py", line 496, in _call_chain
    result = func(*args)
  File "/home/nyuszika7h/.local/pipx/venvs/yt-dlp/lib/python3.10/site-packages/yt_dlp/utils.py", line 2834, in https_open
    return self.do_open(functools.partial(
  File "/home/nyuszika7h/.pyenv/versions/3.10.0/lib/python3.10/urllib/request.py", line 1351, in do_open
    raise URLError(err)
```

**Comment by imba-tjd** [comment]
I guess it requires http proxy but vpn is a vpn. Or you can try normal youtube-dl to see if it works. I can only tell normal one with env var works for me when using v2rayn.

**Comment by imba-tjd** [comment]
Oops, I now guess it's because your proxy doesn't support https proxy, and it needn't.
You can use http proxy when accessing https sites. There is no security issue because the proxy is local.

**Comment by nyuszika7h** [comment]
That's not helpful, as some proxy providers only offer HTTPS and not HTTP.

**Comment by imba-tjd** [comment]
Use curl to check if your proxy supports https. If not, then it's expected that ytdl doesn't work. If curl works, then I think it's a bug.

**Comment by nyuszika7h** [comment]
You don't need to treat me like a noob, I already said that I know for a fact that my proxy supports HTTPS (and even though I don't have a NordVPN account I know their proxies are HTTPS only). But here's the proof:

```
curl --proxy 'https://nyuszika7h:[REDACTED]@swe.secureconnect.me:7070' -s ipinfo.io
{
  "ip": "37.120.153.62",
  "city": "Stockholm",
  "region": "Stockholm",
  "country": "SE",
  "loc": "59.3294,18.0687",
  "org": "AS9009 M247 Ltd",
  "postal": "100 05",
  "timezone": "Europe/Stockholm",
  "readme": "https://ipinfo.io/missingauth"
}
```

**Comment by BlohoJo** [comment]
> try `HTTPS_PROXY` environment variable

Same result (doesn't matter if https_proxy=http://... or https_proxy=https://... is used, it gives exact same result)...

```
E:\USER\temp_ytdl>set https_proxy=http://xxxxxxxxx%40xxxxxxx.com:xxxxxxxxxxxxxxxx@uk2344.nordvpn.com:89

E:\USER\temp_ytdl>yt-dlp.exe -Uv --all-subs --sub-format srt -f "bestvideo[ext=mp4]+bestaudio[ext=m4a]/best[ext=mp4]/best" "https://www.youtube.com/watch?v=Fh7UgrHMjbQ"
[debug] Command-line config: ['-Uv', '--all-subs', '--sub-format', 'srt', '-f','bestvideo[ext=mp4]+bestaudio[ext=m4a]/best[ext=mp4]/best', 'https://www.youtube.com/watch?v=Fh7UgrHMjbQ']
[debug] Encodings: locale cp1252, fs utf-8, out utf-8 (No ANSI), err utf-8 (No ANSI), pref cp1252
[debug] yt-dlp version 2021.12.01 [91f071a] (win_exe)
[debug] Python version 3.8.10 (CPython 64bit) - Windows-2008ServerR2-6.1.7601-SP1
[debug] exe versions: ffmpeg N-93824-g479a5f644f (fdk), ffprobe N-89595-g40d4b13228, rtmpdump 2.4-20151223-gfa8646d-OpenSSL_1.0.2n-x86_64-static
[debug] Optional libraries: Cryptodome, mutagen, sqlite, websockets
[debug] Proxy map: {'https': 'http://xxxxxxxxx%40xxxxxxx.com:xxxxxxxxxxxxxxxx@uk2344.nordvpn.com:89'}
ERROR: Unable to obtain version info; Please try again later or Visit  https://github.com/yt-dlp/yt-dlp/releases/latest
[debug] [youtube] Extracting URL: https://www.youtube.com/watch?v=Fh7UgrHMjbQ
[youtube] Fh7UgrHMjbQ: Downloading webpage
WARNING: [youtube] Unable to download webpage: <urlopen error Remote end closed connection without response>
[youtube] Fh7UgrHMjbQ: Downloading android player API JSON
WARNING: [youtube] <urlopen error Remote end closed connection without response>
. Retrying ...
[youtube] Fh7UgrHMjbQ: Downloading android player API JSON (retry #1)
WARNING: [youtube] <urlopen error Remote end closed connection without response>
. Retrying ...
[youtube] Fh7UgrHMjbQ: Downloading android player API JSON (retry #2)
WARNING: [youtube] <urlopen error Remote end closed connection without response>
. Retrying ...
[youtube] Fh7UgrHMjbQ: Downloading android player API JSON (retry #3)
[youtube] Fh7UgrHMjbQ: Downloading iframe API JS
WARNING: [youtube] Unable to download webpage: <urlopen error Remote end closed
connection without response>
[youtube] Fh7UgrHMjbQ: Downloading web player API JSON
WARNING: [youtube] <urlopen error Remote end closed connection without response>
. Retrying ...
[youtube] Fh7UgrHMjbQ: Downloading web player API JSON (retry #1)
WARNING: [youtube] <urlopen error Remote end closed connection without response>
. Retrying ...
[youtube] Fh7UgrHMjbQ: Downloading web player API JSON (retry #2)
WARNING: [youtube] <urlopen error Remote end closed connection without response>
. Retrying ...
[youtube] Fh7UgrHMjbQ: Downloading web player API JSON (retry #3)
WARNING: [youtube] Unable to download API page: <urlopen error Remote end closed connection without response> (caused by URLError(RemoteDisconnected('Remote end closed connection without response')))
ERROR: [youtube] Fh7UgrHMjbQ: Unable to download API page: <urlopen error Remote end closed connection without response> (caused by URLError(RemoteDisconnected('Remote end closed connection without response'))) (caused by URLError(RemoteDisconnected('Remote end closed connection without response')))
  File "yt_dlp\extractor\common.py", line 715, in _request_webpage
  File "yt_dlp\YoutubeDL.py", line 3385, in urlopen
  File "urllib\request.py", line 525, in open
  File "urllib\request.py", line 542, in _open
  File "urllib\request.py", line 502, in _call_chain
  File "yt_dlp\utils.py", line 2929, in https_open
  File "urllib\request.py", line 1357, in do_open
```

**Comment by xtkoba** [comment]
This is because it is trying to communicate to the proxy server with plain text HTTP, without sending TLS ClientHello.

An example:

```
$ yt-dlp --no-check-certificate --proxy https://localhost:8443/ https://www.youtube.com/watch?v=Fh7UgrHMjbQ
```

The capture log with Wireshark:

```
1	0.000000000	127.0.0.1	127.0.0.1	TCP	74	41882 → 8443 [SYN] Seq=0 Win=65495 Len=0 MSS=65495 SACK_PERM=1 TSval=3045902000 TSecr=0 WS=128
2	0.000042184	127.0.0.1	127.0.0.1	TCP	74	8443 → 41882 [SYN, ACK] Seq=0 Ack=1 Win=65483 Len=0 MSS=65495 SACK_PERM=1 TSval=3045902000 TSecr=3045902000 WS=128
3	0.000078502	127.0.0.1	127.0.0.1	TCP	66	41882 → 8443 [ACK] Seq=1 Ack=1 Win=65536 Len=0 TSval=3045902001 TSecr=3045902000
4	0.004958876	127.0.0.1	127.0.0.1	HTTP	106	CONNECT www.youtube.com:443 HTTP/1.0 
5	0.004982553	127.0.0.1	127.0.0.1	TCP	66	8443 → 41882 [ACK] Seq=1 Ack=41 Win=65536 Len=0 TSval=3045902005 TSecr=3045902005
6	0.005318839	127.0.0.1	127.0.0.1	TCP	66	8443 → 41882 [RST, ACK] Seq=1 Ack=41 Win=65536 Len=0 TSval=3045902006 TSecr=3045902005
7	0.036889929	127.0.0.1	127.0.0.1	TCP	74	41884 → 8443 [SYN] Seq=0 Win=65495 Len=0 MSS=65495 SACK_PERM=1 TSval=3045902037 TSecr=0 WS=128
8	0.036933650	127.0.0.1	127.0.0.1	TCP	74	8443 → 41884 [SYN, ACK] Seq=0 Ack=1 Win=65483 Len=0 MSS=65495 SACK_PERM=1 TSval=3045902037 TSecr=3045902037 WS=128
9	0.036968640	127.0.0.1	127.0.0.1	TCP	66	41884 → 8443 [ACK] Seq=1 Ack=1 Win=65536 Len=0 TSval=3045902037 TSecr=3045902037
10	0.042296838	127.0.0.1	127.0.0.1	HTTP	106	CONNECT www.youtube.com:443 HTTP/1.0 
11	0.042320514	127.0.0.1	127.0.0.1	TCP	66	8443 → 41884 [ACK] Seq=1 Ack=41 Win=65536 Len=0 TSval=3045902043 TSecr=3045902043
12	0.042637384	127.0.0.1	127.0.0.1	TCP	66	8443 → 41884 [RST, ACK] Seq=1 Ack=41 Win=65536 Len=0 TSval=3045902043 TSecr=3045902043
13	0.065908038	127.0.0.1	127.0.0.1	TCP	74	41886 → 8443 [SYN] Seq=0 Win=65495 Len=0 MSS=65495 SACK_PERM=1 TSval=3045902066 TSecr=0 WS=128
14	0.065952387	127.0.0.1	127.0.0.1	TCP	74	8443 → 41886 [SYN, ACK] Seq=0 Ack=1 Win=65483 Len=0 MSS=65495 SACK_PERM=1 TSval=3045902066 TSecr=3045902066 WS=128
15	0.065988844	127.0.0.1	127.0.0.1	TCP	66	41886 → 8443 [ACK] Seq=1 Ack=1 Win=65536 Len=0 TSval=3045902066 TSecr=3045902066
16	0.070534330	127.0.0.1	127.0.0.1	HTTP	106	CONNECT www.youtube.com:443 HTTP/1.0 
17	0.070557238	127.0.0.1	127.0.0.1	TCP	66	8443 → 41886 [ACK] Seq=1 Ack=41 Win=65536 Len=0 TSval=3045902071 TSecr=3045902071
18	0.071488014	127.0.0.1	127.0.0.1	TCP	66	8443 → 41886 [RST, ACK] Seq=1 Ack=41 Win=65536 Len=0 TSval=3045902072 TSecr=3045902071
19	0.097827637	127.0.0.1	127.0.0.1	TCP	74	41888 → 8443 [SYN] Seq=0 Win=65495 Len=0 MSS=65495 SACK_PERM=1 TSval=3045902098 TSecr=0 WS=128
20	0.097871707	127.0.0.1	127.0.0.1	TCP	74	8443 → 41888 [SYN, ACK] Seq=0 Ack=1 Win=65483 Len=0 MSS=65495 SACK_PERM=1 TSval=3045902098 TSecr=3045902098 WS=128
21	0.097907675	127.0.0.1	127.0.0.1	TCP	66	41888 → 8443 [ACK] Seq=1 Ack=1 Win=65536 Len=0 TSval=3045902098 TSecr=3045902098
22	0.103524317	127.0.0.1	127.0.0.1	HTTP	106	CONNECT www.youtube.com:443 HTTP/1.0 
23	0.103546387	127.0.0.1	127.0.0.1	TCP	66	8443 → 41888 [ACK] Seq=1 Ack=41 Win=65536 Len=0 TSval=3045902104 TSecr=3045902104
24	0.104464731	127.0.0.1	127.0.0.1	TCP	66	8443 → 41888 [RST, ACK] Seq=1 Ack=41 Win=65536 Len=0 TSval=3045902105 TSecr=3045902104
25	0.131666266	127.0.0.1	127.0.0.1	TCP	74	41890 → 8443 [SYN] Seq=0 Win=65495 Len=0 MSS=65495 SACK_PERM=1 TSval=3045902132 TSecr=0 WS=128
26	0.131708730	127.0.0.1	127.0.0.1	TCP	74	8443 → 41890 [SYN, ACK] Seq=0 Ack=1 Win=65483 Len=0 MSS=65495 SACK_PERM=1 TSval=3045902132 TSecr=3045902132 WS=128
27	0.131743651	127.0.0.1	127.0.0.1	TCP	66	41890 → 8443 [ACK] Seq=1 Ack=1 Win=65536 Len=0 TSval=3045902132 TSecr=3045902132
28	0.136012564	127.0.0.1	127.0.0.1	HTTP	106	CONNECT www.youtube.com:443 HTTP/1.0 
29	0.136034983	127.0.0.1	127.0.0.1	TCP	66	8443 → 41890 [ACK] Seq=1 Ack=41 Win=65536 Len=0 TSval=3045902136 TSecr=3045902136
30	0.136937613	127.0.0.1	127.0.0.1	TCP	66	8443 → 41890 [RST, ACK] Seq=1 Ack=41 Win=65536 Len=0 TSval=3045902137 TSecr=3045902136
31	0.164032082	127.0.0.1	127.0.0.1	TCP	74	41892 → 8443 [SYN] Seq=0 Win=65495 Len=0 MSS=65495 SACK_PERM=1 TSval=3045902164 TSecr=0 WS=128
32	0.164075104	127.0.0.1	127.0.0.1	TCP	74	8443 → 41892 [SYN, ACK] Seq=0 Ack=1 Win=65483 Len=0 MSS=65495 SACK_PERM=1 TSval=3045902165 TSecr=3045902164 WS=128
33	0.164108837	127.0.0.1	127.0.0.1	TCP	66	41892 → 8443 [ACK] Seq=1 Ack=1 Win=65536 Len=0 TSval=3045902165 TSecr=3045902165
34	0.169642578	127.0.0.1	127.0.0.1	HTTP	106	CONNECT www.youtube.com:443 HTTP/1.0 
35	0.169665207	127.0.0.1	127.0.0.1	TCP	66	8443 → 41892 [ACK] Seq=1 Ack=41 Win=65536 Len=0 TSval=3045902170 TSecr=3045902170
36	0.170572027	127.0.0.1	127.0.0.1	TCP	66	8443 → 41892 [RST, ACK] Seq=1 Ack=41 Win=65536 Len=0 TSval=3045902171 TSecr=3045902170
37	0.202221409	127.0.0.1	127.0.0.1	TCP	74	41894 → 8443 [SYN] Seq=0 Win=65495 Len=0 MSS=65495 SACK_PERM=1 TSval=3045902203 TSecr=0 WS=128
38	0.202263035	127.0.0.1	127.0.0.1	TCP	74	8443 → 41894 [SYN, ACK] Seq=0 Ack=1 Win=65483 Len=0 MSS=65495 SACK_PERM=1 TSval=3045902203 TSecr=3045902203 WS=128
39	0.202298095	127.0.0.1	127.0.0.1	TCP	66	41894 → 8443 [ACK] Seq=1 Ack=1 Win=65536 Len=0 TSval=3045902203 TSecr=3045902203
40	0.207750680	127.0.0.1	127.0.0.1	HTTP	106	CONNECT www.youtube.com:443 HTTP/1.0 
41	0.207772331	127.0.0.1	127.0.0.1	TCP	66	8443 → 41894 [ACK] Seq=1 Ack=41 Win=65536 Len=0 TSval=3045902208 TSecr=3045902208
42	0.208688859	127.0.0.1	127.0.0.1	TCP	66	8443 → 41894 [RST, ACK] Seq=1 Ack=41 Win=65536 Len=0 TSval=3045902209 TSecr=3045902208
43	0.237364466	127.0.0.1	127.0.0.1	TCP	74	41896 → 8443 [SYN] Seq=0 Win=65495 Len=0 MSS=65495 SACK_PERM=1 TSval=3045902238 TSecr=0 WS=128
44	0.237421457	127.0.0.1	127.0.0.1	TCP	74	8443 → 41896 [SYN, ACK] Seq=0 Ack=1 Win=65483 Len=0 MSS=65495 SACK_PERM=1 TSval=3045902238 TSecr=3045902238 WS=128
45	0.237461336	127.0.0.1	127.0.0.1	TCP	66	41896 → 8443 [ACK] Seq=1 Ack=1 Win=65536 Len=0 TSval=3045902238 TSecr=3045902238
46	0.242908613	127.0.0.1	127.0.0.1	HTTP	106	CONNECT www.youtube.com:443 HTTP/1.0 
47	0.242932220	127.0.0.1	127.0.0.1	TCP	66	8443 → 41896 [ACK] Seq=1 Ack=41 Win=65536 Len=0 TSval=3045902243 TSecr=3045902243
48	0.243253700	127.0.0.1	127.0.0.1	TCP	66	8443 → 41896 [RST, ACK] Seq=1 Ack=41 Win=65536 Len=0 TSval=3045902244 TSecr=3045902243
49	0.269747672	127.0.0.1	127.0.0.1	TCP	74	41898 → 8443 [SYN] Seq=0 Win=65495 Len=0 MSS=65495 SACK_PERM=1 TSval=3045902270 TSecr=0 WS=128
50	0.269789926	127.0.0.1	127.0.0.1	TCP	74	8443 → 41898 [SYN, ACK] Seq=0 Ack=1 Win=65483 Len=0 MSS=65495 SACK_PERM=1 TSval=3045902270 TSecr=3045902270 WS=128
51	0.269822821	127.0.0.1	127.0.0.1	TCP	66	41898 → 8443 [ACK] Seq=1 Ack=1 Win=65536 Len=0 TSval=3045902270 TSecr=3045902270
52	0.277527232	127.0.0.1	127.0.0.1	HTTP	106	CONNECT www.youtube.com:443 HTTP/1.0 
53	0.277549301	127.0.0.1	127.0.0.1	TCP	66	8443 → 41898 [ACK] Seq=1 Ack=41 Win=65536 Len=0 TSval=3045902278 TSecr=3045902278
54	0.277867149	127.0.0.1	127.0.0.1	TCP	66	8443 → 41898 [RST, ACK] Seq=1 Ack=41 Win=65536 Len=0 TSval=3045902278 TSecr=3045902278
55	0.306707163	127.0.0.1	127.0.0.1	TCP	74	41900 → 8443 [SYN] Seq=0 Win=65495 Len=0 MSS=65495 SACK_PERM=1 TSval=3045902307 TSecr=0 WS=128
56	0.306749906	127.0.0.1	127.0.0.1	TCP	74	8443 → 41900 [SYN, ACK] Seq=0 Ack=1 Win=65483 Len=0 MSS=65495 SACK_PERM=1 TSval=3045902307 TSecr=3045902307 WS=128
57	0.306784827	127.0.0.1	127.0.0.1	TCP	66	41900 → 8443 [ACK] Seq=1 Ack=1 Win=65536 Len=0 TSval=3045902307 TSecr=3045902307
58	0.319160577	127.0.0.1	127.0.0.1	HTTP	106	CONNECT www.youtube.com:443 HTTP/1.0 
59	0.319183485	127.0.0.1	127.0.0.1	TCP	66	8443 → 41900 [ACK] Seq=1 Ack=41 Win=65536 Len=0 TSval=3045902320 TSecr=3045902320
60	0.319525987	127.0.0.1	127.0.0.1	TCP	66	8443 → 41900 [RST, ACK] Seq=1 Ack=41 Win=65536 Len=0 TSval=3045902320 TSecr=3045902320
```

**Comment by pukkandan** [comment]
I have no clue how any of yt-dlp's low level network handlers work. So someone else will have to figure out how to fix this issue

**Comment by xtkoba** [comment]
One quick workaround would be to use a network repeater like `stone` (https://www.gcd.org/sengoku/stone/) that is capable of translation such as:

```
[python]<--(plain-text proxy)-->[repeater]<--(TLS proxy)-->[secure web (HTTPS) proxy server]
```

A descent fix would be to migrate to `urllib3` (https://github.com/urllib3/urllib3) which I confirm can handle secure web proxy.

**Comment by BlohoJo** [comment]
Stone looked very promising, but what worked for you did not work for me... I get error 10061

```
E:\stone>stone uk2044.nordvpn.com:89/ssl 8080
Dec 17 03:58:12.147000 26024 start (2.3e) [26076]
Dec 17 03:58:12.163000 26024 stone 360: 127.179.0.37:89/ssl <- 0.0.0.0:8080
Dec 17 03:59:40.038000 6272 360 TCP 776: connect getsockopt err=10061
Dec 17 03:59:41.161000 29332 360 TCP 708: connect getsockopt err=10061
Dec 17 03:59:42.269000 29356 360 TCP 832: connect getsockopt err=10061
Dec 17 03:59:54.312000 29456 360 TCP 776: connect getsockopt err=10061
Dec 17 03:59:55.435000 29532 360 TCP 888: connect getsockopt err=10061
Dec 17 03:59:56.574000 29592 360 TCP 876: connect getsockopt err=10061
Dec 17 03:59:57.697000 29600 360 TCP 832: connect getsockopt err=10061
Dec 17 03:59:58.820000 29628 360 TCP 708: connect getsockopt err=10061
Dec 17 03:59:59.975000 29664 360 TCP 776: connect getsockopt err=10061
Dec 17 04:00:01.098000 29660 360 TCP 888: connect getsockopt err=10061
Dec 17 04:00:20.005000 29544 360 TCP 876: connect getsockopt err=10061
Dec 17 04:00:21.144000 29256 360 TCP 832: connect getsockopt err=10061
Dec 17 04:00:22.267000 29300 360 TCP 708: connect getsockopt err=10061
Dec 17 04:00:25.029000 29336 360 TCP 872: connect getsockopt err=10061
Dec 17 04:00:26.152000 29564 360 TCP 776: connect getsockopt err=10061
Dec 17 04:00:27.291000 29428 360 TCP 660: connect getsockopt err=10061
Dec 17 04:00:30.021000 29672 360 TCP 704: connect getsockopt err=10061
Dec 17 04:00:31.144000 29636 360 TCP 876: connect getsockopt err=10061
Dec 17 04:00:32.267000 28988 360 TCP 724: connect getsockopt err=10061
```

etc etc etc

Spent a lot of time on this and nothing I try will get past this.

Damn!

**Comment by xtkoba** [comment]
Ah, apparently the prebuilt distributions of `stone` for Windows are bundled with OpenSSL 0.9.8zg, which does not support TLS/1.2 (or later) required for nordvpn.com.

FWIW, I tested on Android (with OpenSSL 1.1.1m) and had no such errors. Without specifying username:password for the proxy (as I do not have an account for the service) I got the following message from yt-dlp, which indicates that `stone` itself can work correctly:

```
WARNING: [youtube] <urlopen error Tunnel connection failed: 407 Proxy Authentication Required>. Retrying ...
```

I wonder if there are other packet repeaters that can be used for this purpose.

Also I will try to build `stone` by myself for Windows with MinGW toolchain.

**Comment by xtkoba** [comment]
A `stone` executable for Windows x64 (with OpenSSL 1.1.1m): https://github.com/xtkoba/yt-dlp/blob/stone/stone-2.4-x64.zip. Tested to work as expected on Wine.

**Comment by BlohoJo** [comment]
Thanks!

I had actually figured that out myself... I was using [http://gcd.org/sengoku/stone/stone64-2.3e-2.3.3.20.zip](http://gcd.org/sengoku/stone/stone64-2.3e-2.3.3.20.zip), and got it working by replacing `libeay32.dll` and `ssleay32.dll` with the ones from [`openssl-1.0.2u-x64_86-win64.zip`](https://github.com/IndySockets/OpenSSL-Binaries/blob/master/openssl-1.0.2u-x64_86-win64.zip) (located [here](https://github.com/IndySockets/OpenSSL-Binaries)).

But the 2.4 compile with OpenSSL 1.1.1m is way better, thanks! :)

**Comment by coletdjnz** [comment]
Possibly related: https://github.com/ytdl-org/youtube-dl/issues/26709

**Comment by coletdjnz** [comment]
https://github.com/yt-dlp/yt-dlp/pull/3668 should allow HTTPS proxies to work by using requests/urllib3

If someone can test that it works with HTTPS proxies that would be awesome :smiley: 

(make sure requests dependency is installed)

builds, if you prefer that: https://github.com/coletdjnz/yt-dlp-dev/releases/tag/2022.06.22.014951

**Comment by sergeevabc** [comment]
@coletdjnz, your summer build is a lifesaver when using a SSL proxy, but the latest yt-dlp dev builds (November 2022) still do not have this feature, why?

**Comment by coletdjnz** [comment]
> @coletdjnz, your summer build is a lifesaver when using a SSL proxy, but the latest yt-dlp dev builds (November 2022) still do not have this feature, why?

The relevant PR(s) are still waiting to be reviewed. They are big changes and I don't think pukkandan has much time to go through them right now. 

I try keep the branches up to date since I use them personally, so you could always manually build from them in the meantime.
